{"$id":"https://example.invalid/crosstrace/pilot-release-manifest.schema.json","$schema":"https://json-schema.org/draft/2020-12/schema","additionalProperties":false,"properties":{"$schema":{"const":"pilot-release-manifest.schema.json"},"claim_level":{"const":"P0_SCRIPTED_CONFORMANCE"},"conditions":{"items":{"type":"string"},"maxItems":5,"minItems":5,"type":"array","uniqueItems":true},"episode_count":{"const":300},"evidence_byte_unit":{"minLength":1,"type":"string"},"implementation":{"additionalProperties":false,"properties":{"package":{"const":"crosstrace-protocol-sketch"},"package_version":{"const":"0.1.0"},"runner":{"const":"crosstrace_sketch.pilot.runner"},"source_tree_hash":{"pattern":"^sha256:[0-9a-f]{64}$","type":"string"}},"required":["package","package_version","runner","source_tree_hash"],"type":"object"},"model_policy":{"const":"no model calls"},"network_policy":{"const":"no network calls"},"oracle_policy":{"minLength":1,"type":"string"},"pilot_id":{"const":"crosstrace-scripted-systems-pilot-v0.1"},"scenarios":{"items":{"type":"string"},"maxItems":6,"minItems":6,"type":"array","uniqueItems":true},"schema_version":{"const":1},"seeds":{"items":{"maximum":9,"minimum":0,"type":"integer"},"maxItems":10,"minItems":10,"type":"array","uniqueItems":true},"statistical_status":{"minLength":1,"type":"string"},"title":{"minLength":1,"type":"string"},"unit":{"minLength":1,"type":"string"}},"required":["$schema","schema_version","pilot_id","title","claim_level","conditions","scenarios","seeds","unit","network_policy","model_policy","oracle_policy","evidence_byte_unit","statistical_status","episode_count","implementation"],"title":"CrossTrace scripted pilot resolved release manifest","type":"object"}
