{"$schema":"pilot-release-manifest.schema.json","claim_level":"P0_SCRIPTED_CONFORMANCE","conditions":["ordinary_local_logs","central_append_only_log","isolated_signed_logs","paired_receipts","paired_receipts_with_gate"],"episode_count":300,"evidence_byte_unit":"canonical bytes of all visible retained copies in the joined evidence artifact","implementation":{"package":"crosstrace-protocol-sketch","package_version":"0.1.0","runner":"crosstrace_sketch.pilot.runner","source_tree_hash":"sha256:45593b305e58a2f8f1b9c93f39cb7923d9831c8cc0036226dac723e0e4c80a7f"},"model_policy":"no model calls","network_policy":"no network calls","oracle_policy":"oracle values are available only to the scorer","pilot_id":"crosstrace-scripted-systems-pilot-v0.1","scenarios":["valid_current_within_scope","withheld_broker_record","equivocation_joined_views","revoked_authority","over_limit","local_replay"],"schema_version":1,"seeds":[0,1,2,3,4,5,6,7,8,9],"statistical_status":"fixture variants are syntactic robustness checks, not independent trials","title":"CrossTrace scripted systems conformance pilot","unit":"one deterministic condition-scenario-fixture execution"}
